SPMCODE	SECTION	TAXA-Current_determination	LOOK-UP_Authors	ID.modifier	LOOK-UP_WCM-ID	LOOK-UP_Accepted name	LOOK-UP Parent Name	Determined_by	Determined_date	determination_reasoning_notes	Lab_receiving_material	Received_Materials	Type_of_material	Date_received	Institution_Person_sending_material	Ownership_of_Sequence	TAXA.received.as_piped_add_dets	Original_Tube_No	Accession_Num_Voucher	voucher_location	Collectors	Collector_no	TDWG	Country	State_Province_Region_territory	substate	substate rank	Site	habitat	associates	plant-attributes	latitute	longitude	datum	elevation	elevation_source	coordinates_source	photos	Original_project		Specimen_Notes	Imaged	Use_in_NSF-CAREX-1255901_Project	Database_Notes	SPM.EXCLUDE	SPM.DATE.EXCLUSION	SPM.EXCLUSION.NOTES	SEQUENCE_NAME	PERMISSION_TO_USE	temp-sn don't need to check	Include2019GlobalCarex	tipLabels2019	NCBI_geo_loc_name	ETS_NCBI_ACCESSION	ITS_NCBI_ACCESSION	matK_NCBI_ACCESSION	Projects_IncompleteList	SEQUENCED
spm00000249		Carex breedlovei	#N/A	sp. nov ined	#N/A	#N/A	#N/A	Anton Reznicek			MOR	yes	herbarium leaf tissue	5/1/2013	Anton Reznicek (MICH)	REZNICEK	Carex "breedlonei" sp. nov ined (section Feandae)	NA	MICH.1132433	MICH	S. Gonzalez & AA Reznicek, w/ M. Gonzalaz, M.Pinedo	10478	MXT	Mexico	Chiapas			Mpio, Tenejapa: Ca. ; 2km (air) NE of Tenejapa, along small road off the tenejapa-Kulak' tik Road.	Wet, bare soil of roadshide bank.		Single large clump				2100m					Carex breedlovei	number listed for accession # is num on barcode.	no	1								TRUE	Carex_breedlovei|MXT|spm00000249	Mexico: Chiapas	MN760977	MN762091	MN763222	Global biogeography of Carex (Martin-Bravo et al.)	yes
spm00000250		Carex boliviensis subsp. occidentalis	Reznicek & S.González		urn:kew.org:wcs:taxon:225014	accepted		Anton Reznicek			MOR	yes	herbarium leaf tissue	5/1/2013	Anton Reznicek (MICH)	REZNICEK	Carex boliviensis subsp. occidentalis	NA	MICH.1132407	MICH	S. Gonzalez	5163	MXE	Mexico	Durango	El Mezquital	Municipio	16 km de La Ventana, por el camino a Charcos-Sta. Ma. De Ocotan							2490m					Carex boliviensis subsp. occidentalis	number listed for accession # is num on barcode.	no	1								TRUE	Carex_boliviensis_ssp_occidentalis|MXE|spm00000250	Mexico: Durango, El Mezquital Municipio	MN760567	MN761621		Global biogeography of Carex (Martin-Bravo et al.)	yes
spm00000251		Carex chordalis	Liebm.		urn:kew.org:wcs:taxon:225518	not accepted	Carex jamesonii var. gracilis				MOR	yes	herbarium leaf tissue	5/1/2013	Anton Reznicek (MICH)	REZNICEK	Carex chordata|Carex chordalis	NA	MICH.1132491	MICH	S. Gonzalez & AA Reznicek w/ M. Pinedo	10550	MXC	Mexico	Morelos			Mpio. Huitzilac: Parque Nacional Lagunas de Zempoala, ca 1 km above Lago de Zempoala												Carex chordalis	number listed for accession # is num on barcode.	no	1								TRUE	Carex_chordalis|MXC|spm00000251	Mexico: Morelos	MN761070	MN762558	MN763114	Global biogeography of Carex (Martin-Bravo et al.)	yes
spm00000252		Carex bartlettii	O'Neill		urn:kew.org:wcs:taxon:224881	not accepted	Carex polystachya var. bartlettii				MOR	yes	herbarium leaf tissue	5/1/2013	Anton Reznicek (MICH)	REZNICEK	Carex bartlettii	Carex_MOR_214	MICH.1132398	MICH	Stanley D. Jones & Royce Oliver	10606	BLZ	Belize		Cayo	District	36.3 mi NW on the Hummingbird Hwy from Dangriga towards Belmopan.; foothills of the Maya Mtns., dolomite												Carex bartlettii	number listed for accession # is num on barcode.	no	1								FALSE		Belize
spm00000253		Carex aztecica	Mack.	aff.	urn:kew.org:wcs:taxon:224830	accepted					MOR	yes	herbarium leaf tissue	5/1/2013	Anton Reznicek (MICH)	REZNICEK	Carex aff. aztecica	NA	MICH.1132380	MICH	S. Gonzalez & AA Reznicek w/ M. Gonzalez, M. Pinedo	10794	MXG	Mexico	Veracruz			Mpio. Acultzingo: Cumbres de Acultzingo, near Puerto del Aire, SW of Acultzingo (km 28.5) on road to Tehuacan												Carex aztecica	number listed for accession # is num on barcode.	no	1								TRUE	Carex_aztecica|MXG|spm00000253	Mexico: Veracruz	MN759929	MN761531		Global biogeography of Carex (Martin-Bravo et al.)	yes
spm00000254		Carex aztecica	Mack.		urn:kew.org:wcs:taxon:224830	accepted					MOR	yes	herbarium leaf tissue	5/1/2013	Anton Reznicek (MICH)	REZNICEK	Carex aztecica	NA	MICH.1132382	MICH	W.R. Anderson, M.W. Chase, and A.A. Reznicek	13061	MXS	Mexico	Oaxaca			18 km NE of Hwy 190 on road to Guelatao (Hwy 175)												Carex aztecica	number listed for accession # is num on barcode.	no	1								TRUE	Carex_aztecica|MXS|spm00000254	Mexico: Oaxaca	MN759930	MN761472	MN763537	Global biogeography of Carex (Martin-Bravo et al.)	yes
spm00000255		Carex boliviensis subsp. boliviensis	0		urn:kew.org:wcs:taxon:225013	accepted					MOR	yes	herbarium leaf tissue	5/1/2013	Anton Reznicek (MICH)	REZNICEK	Carex boliviensis	NA	MICH.1132410	MICH	P.F. Zika	15389	MXC	Mexico	Mexico			3.2 road km N of Paso de Cortes, S slope of Volcan Ixtaccihuatl												Carex boliviensis	number listed for accession # is num on barcode.	no	1								TRUE	Carex_boliviensis_ssp_boliviensis|MXC|spm00000255	Mexico: Mexico	MN760564	MN761620	MN763561	Global biogeography of Carex (Martin-Bravo et al.)	yes
spm00000256		Carex atractodes	F.J.Herm.		urn:kew.org:wcs:taxon:224722	accepted		Robert F.C. Naczi	2000		MOR	yes	herbarium leaf tissue	5/1/2013	Anton Reznicek (MICH)	REZNICEK	Carex atractodes	NA	MICH.1132374	MICH	S. Zamudio and E. Carranza		MXE	Mexico	San Luis Potosi	Xilitla		Centro Regional del Bajio; Llano del Conejo, municipio de Xilitla												Carex atractodes	number listed for accession # is num on barcode.	no	1								TRUE	Carex_atractodes|MXE|spm00000256	Mexico: San Luis Potosi, Xilitla 	MN759814	MN761438	MN763555	Global biogeography of Carex (Martin-Bravo et al.)	yes
spm00000257		Carex asynchrona	Naczi		urn:kew.org:wcs:taxon:224698	accepted					MOR	yes	herbarium leaf tissue	5/1/2013	Anton Reznicek (MICH)	REZNICEK	Carex asynchrona	NA	MICH.1216176	MICH	AA Reznicek w/ S. Zamudio, G. Ocampo	11067	MXE	Mexico	Queretaro			Mpio. Landa de Matamoras: Llano Chiquito, southern portion	Moist ravine in Quercus-Pinus forest at edge of Llano.		Scarce in one small area, perigynia all shed.				2200m					Carex asynchrona	number listed for accession # is num on barcode.	no	1								TRUE	Carex_asynchrona|MXE|spm00000257	Mexico: Queretaro	MN761207			Global biogeography of Carex (Martin-Bravo et al.)	yes
spm00000258		Carex anisostachys	Liebm.		urn:kew.org:wcs:taxon:224506	accepted					MOR	yes	herbarium leaf tissue	5/1/2013	Anton Reznicek (MICH)	REZNICEK	Carex anisostachys	NA	MICH.1132344	MICH	S. Gonzalez & A.A. Reznicek w/ M. Gonzalez & M. Pinedo	10784	MXT	Mexico	Chiapas			Mpio, Zinacantan: Ca. 1 km from Zinacantan along road between Zinacantan and Salina												Carex anisostachys	number listed for accession # is num on barcode.	no	1								TRUE	Carex_anisostachys|MXT|spm00000258	Mexico: Chiapas	MN760767	MN761821	MN763090	Global biogeography of Carex (Martin-Bravo et al.)	yes
spm00000259		Carex anisostachys	Liebm.		urn:kew.org:wcs:taxon:224506	accepted					MOR	yes	herbarium leaf tissue	5/1/2013	Anton Reznicek (MICH)	REZNICEK	Carex anisostachys	NA	MICH.1132362	MICH	S. Gonzalez & A.A. Reznicek w/ M. Pinedo	10294	MXE	Mexico	Queretaro			Mpio. Landa de Matamoras: Ca. 2 km SW of Pinal de Amoles on road (Hwy 120) to San Juan del Rio							2580m					Carex anisostachys	number listed for accession # is num on barcode.	no	1								TRUE	Carex_anisostachys|MXE|spm00000259	Mexico: Queretaro	MN760489	MN761923		Global biogeography of Carex (Martin-Bravo et al.)	yes
spm00000260		Carex anisostachys	Liebm.		urn:kew.org:wcs:taxon:224506	accepted		Anton Reznicek			MOR	yes	herbarium leaf tissue	5/1/2013	Anton Reznicek (MICH)	REZNICEK	Carex anisostachys	NA	MICH.1132361	MICH	William R. Anderson, M.W. Chase, and A.A. Reznicek	13062	MXS	Mexico	Oaxaca			18 km NE of Hwy 190 on road to Guelatao (Hwy 175)	mesic ravine in pine forest		scarce				2420m					Carex anisostachys	number listed for accession # is num on barcode.	no	1								TRUE	Carex_anisostachys|MXS|spm00000260	Mexico: Oaxaca	MN760635	MN761798	MN763087	Global biogeography of Carex (Martin-Bravo et al.)	yes
spm00000261		Carex anisostachys	Liebm.		urn:kew.org:wcs:taxon:224506	accepted		Anton Reznicek			MOR	yes	herbarium leaf tissue	5/1/2013	Anton Reznicek (MICH)	REZNICEK	Carex anisostachys	NA	MICH.1132345	MICH	S. Gonzalez & A.A. Reznicek w/ M. Gonzalez & M. Pinedo	10795	MXG	Mexico	Veracruz			Mpio. Acultzingo: Cumbres de Acultzingo, near Puerto del Aire, SW of Acultzingo (km 28.5) on road to Tehuacan	humid oak forest, with a few pines; heavily disturbed and grazed.		Locally abundant; scattered single plants on the road bank and into the forest.	18° 42' 00"N	97° 20'13"W		2070m					Carex anisostachys	number listed for accession # is num on barcode./ Reznicek note regarding voucher- nore than 1 sp here.	no	1								TRUE	Carex_anisostachys|MXG|spm00000261	Mexico: Veracruz	MN760580	MN761887		Global biogeography of Carex (Martin-Bravo et al.)	yes
spm00000262		Carex angustispica	Reznicek & S.González		urn:kew.org:wcs:taxon:224500	accepted		Anton Reznicek			MOR	yes	herbarium leaf tissue	5/1/2013	Anton Reznicek (MICH)	REZNICEK	Carex angustispica	NA	MICH.1132341	MICH	A.A. Reznicek & S.A. Reznicek	8077	MXS	Mexico	Oaxaca			Sierra de Juarez, along hwy 175 0.6 km by road SW of Mirador at Cerro Pelon, ca. 60 km NE of Oaxaca.	Dry, stony mountain ridge dominated by grasses, sedges, and small shrubs with scattered dwarfed pines.		frequent in dense clumps.									Carex angustispica	number listed for accession # is num on barcode.	no	1								TRUE	Carex_angustispica|MXS|spm00000262	Mexico: Oaxaca	MN760565	MN761537	MN763181	Global biogeography of Carex (Martin-Bravo et al.)	yes
spm00000263		Carex chihuahuensis	Mack.		urn:kew.org:wcs:taxon:225486	accepted		S.Martin Bravo & P. Jimenez-Mejias			MOR	yes	herbarium leaf tissue	5/1/2013	Anton Reznicek (MICH)	REZNICEK	Carex agrostoides|Carex chihuahuensis	NA	MICH.1132335	MICH	A.C. Sanders w/ L. Lubinsky, A. Mayor, D. Kossack, & C. Spenger	13474	MXE	Mexico	Tamaulipas			Mpio. Alamos: La Huerta, an abandoned settlement at the head of a canyon called Los Guyabos, on the Chalaton Trail, Sierr de Alamos.	Oak woodland with tropical deciduous forest elements		a fairly common clump-forming perennial at wet seeps in the canyon bottom.	26° 59'N	108° 58' W		1100m					Carex agrostoides	number listed for accession # is num on barcode.	no	1								TRUE	Carex_chihuahuensis|MXE|spm00000263	Mexico: Tamaulipas	MN760734	MN761673	MN763188	Global biogeography of Carex (Martin-Bravo et al.)	yes
spm00000264		Carex caeligena	Reznicek		urn:kew.org:wcs:taxon:225230	accepted					MOR	yes	herbarium leaf tissue	5/1/2013	Anton Reznicek (MICH)	REZNICEK	Carex caligena|Carex caeligena	NA	MICH.1132451	MICH	A.A. Reznicek w/ R.F.C. Naczi	8468	MXE	Mexico	Tamaulipas			Mpio. Gomez Farias, vicinity of Rancho del Cielo Biological Station ca. 7 km WNW of Gomez Farias. NE of Indian Springs (Ojo de Agua de los Indios) towards Agua Linda	Sunny, open clearing between 2 low ridges in open Pinus forest.		Scarce on drier, upper edges of clearing.				1500m					Carex caligena	number listed for accession # is num on barcode.	no	1								TRUE	Carex_caligena|MXE|spm00000264	Mexico: Tamaulipas	MN760637	MN761559	MN763065	Global biogeography of Carex (Martin-Bravo et al.)	yes
spm00000265		Carex chihuahuensis	Mack.		urn:kew.org:wcs:taxon:225486	accepted		Anton Reznicek			MOR	yes	herbarium leaf tissue	5/1/2013	Anton Reznicek (MICH)	REZNICEK	Carex chichuahuensis	NA	MICH.1204227	MICH	V.W. Steinmann & A. Burquez, C. Lindquist, A.L. Reina G., T.R. Van Devender, L. Varela E.	881	MXN	Mexico	Sonora			Mpio. Yecora; small canyon on the east side of MEX 16, 4.8 km (by road) southwest of Puerto de la Cruz, near a seep called El Aguajito	moist soil along the shady canyon bottom in pine-oak woodland	Buddleja parviflora, Cuphea llavea, Geranium, Lobelia laxiflora, Mimulus cardinalis, Platanus wrightii, Salvia, Toxicodendrons radicans.	Solitary perennial forming a large clump	28° 22'16"N	109° 02'51"W		1750m					Carex chihuahuensis	number listed for accession # is num on barcode.	no	1								TRUE	Carex_chihuahuensis|MXN|spm00000265	Mexico: Sonora	MN760735	MN761672	MN763005	Global biogeography of Carex (Martin-Bravo et al.)	yes
spm00000266		Carex sect.Fecundae - Chiapas	#N/A	Carex sp. nov "balden" section Fecundae	#N/A	#N/A	#N/A				MOR	yes	herbarium leaf tissue	5/1/2013	Anton Reznicek (MICH)	REZNICEK	Carex sp. nov "balden" section Fecundae (maybe "Golden"??)	Carex_MOR_228	MICH. A 1000186 (sheet 1 of 2)	MICH	S. Gonzalez & A.A. Reznicek w/ M. Gonzalez & M. Pinedo	10502	MXT	Mexico	Chiapas			Mpio. Tenejapa: Along the road between Matzam and Ach'lum. 2460.	wet, seepage slow meadow	Eleocharis, Carex, Juncus, Equisetum, Cyperus, and grasses.	two very large spreading clumps in very wet soil; scales pale brown, perigynia greenish.	16° 47'02"N	92° 27'53"W		2460m					Carex sect.Fecundae - Chiapas	number listed for accession # is num on barcode.	no	1								FALSE		Mexico: Chiapas
spm00000267		Carex chiapensis	F.J.Herm.		urn:kew.org:wcs:taxon:225484	accepted					MOR	yes	herbarium leaf tissue	5/1/2013	Anton Reznicek (MICH)	REZNICEK	Carex chiapensis	NA	MICH.1132453	MICH	S. Gonzalez & A.A. Reznicek w/ M. Pinedo	10528	MXS	Mexico	Oaxaca			Distrito Ixtlan de Juarez: Below Cerro Pelon, along Hwy 175 (Tuxtepec-Oaxaca Hwy)	wet, seepy rocky slopes along road in humid forest dominated by Pinus.		common in small clumps in open areas.	17 ° 35' 00" N	96° 30' 06"W		2950m					Carex chiapensis	number listed for accession # is num on barcode.	no	1								TRUE	Carex_chiapensis|MXS|spm00000267	Mexico: Oaxaca	MN760632	MN761558	MN763062	Global biogeography of Carex (Martin-Bravo et al.)	yes
spm00000268		Carex coulteri	Boott ex Hemsl.		urn:kew.org:wcs:taxon:225714	accepted					MOR	yes	herbarium leaf tissue	5/1/2013	Anton Reznicek (MICH)	REZNICEK	Carex coulteri	NA	MICH.1132553	MICH	S. Gonzalez & A.A. Reznicek w/ M. Gonzalez & M. Pinedo	10799	MXC	Mexico	Mexico			Mpio. Huixquilucan: Ca. 10 km past Huixquilucan along road to Rio Hondo.	Dry oak forest in steep ravine.		locally common on edge of cliff (upper part of ravine) edge of oak forest.	19°24'00" M	99° 17'06"W		2550m					Carex coulteri	number listed for accession # is num on barcode.	no	1								TRUE	Carex_coulteri|MXC|spm00000268	Mexico: Mexico	MN760633	MN761888	MN763063	Global biogeography of Carex (Martin-Bravo et al.)	yes
spm00000269		Carex leucodonta	Holm		urn:kew.org:wcs:taxon:228133	not accepted	Carex turbinata				MOR	yes	herbarium leaf tissue	5/1/2013	Anton Reznicek (MICH)	REZNICEK	Carex leucodonta	NA	MICH.1132687	MICH	R. Spellenberg, L. Brouillet, T.K. Todsen		MXE	Mexico	Chihuahua			Mcpio. De Adolfo Lopez Mateos, 18 km E of junction of highway to San Juanito E of Baseaseachi on highway to Tomochic, at pass slightly E of El Perico, then 1.1 km S by winding dirt road going to Rancho El Fresno	pale volcanic soil	Pinus arizonica, Quercus sideroxyla, Q. mcvaughii, Arctostaphylos, Arbutus xalapense.	petals ochroleucous.	28°15.69'N	108°03.64'W		2355m					Carex leucodonta	number listed for accession # is num on barcode.	no	1								TRUE	Carex_leucodonta|MXE|spm00000269	Mexico: Chihuahua	MN760627		MN763025	Global biogeography of Carex (Martin-Bravo et al.)	yes
spm00000270		Carex lemanniana	Boott		urn:kew.org:wcs:taxon:228039	accepted		G. Davidse	1998		MOR	yes	herbarium leaf tissue	5/1/2013	Anton Reznicek (MICH)	REZNICEK	Carex lemanniana	Carex_MOR_232	MICH.1132681	MICH	E. Alfaro	583	COS	Costa Rica		Cartago	City	Canton de Perez Zeledon P.N. Chirripo Cordillera de Talamanca. P.Z. Distrito Rivas. Sendero Valle Los Conejos y Cerro Chiripo en Faramo.				9°27'58"N	83°29'40"W		3400-3739m					Carex lemanniana	number listed for accession # is num on barcode.	no	1		TRUE	42396	Mislabeling/contamination				FALSE		Costa Rica
spm00000271		Carex humboldtiana	Steud.		urn:kew.org:wcs:taxon:227445	accepted					MOR	yes	herbarium leaf tissue	5/1/2013	Anton Reznicek (MICH)	REZNICEK	Carex humboldtiana	NA	MICH.1132630	MICH	S. Gonzalez & A.A. Reznicek w/ M. Gonzalez & M. Pinedo	10800	MXC	Mexico	Mexico			Mpio. Huixquilucan: Ca. 10 km past Huixquilucan along road to Rio Hondo	dry oak forest in steep reavine.		abundant at the edge of the forest and even into open weedy areas.	19°24'00"N	99°17'06"W		2550m					Carex humboldtiana	number listed for accession # is num on barcode.	no	1								TRUE	Carex_humboldtiana|MXC|spm00000271	Mexico: Mexico	MN759963	MN762150		Global biogeography of Carex (Martin-Bravo et al.)	yes
spm00000272		Carex durangensis	Reznicek & S.González		urn:kew.org:wcs:taxon:226214	accepted					MOR	yes	herbarium leaf tissue	5/1/2013	Anton Reznicek (MICH)	REZNICEK	Carex durangensis	NA	MICH.1216175	MICH	A.A. Reznicek & S. Gonzalez w/ M. Pinedo	11153	MXE	Mexico	Durango			Mpio. Pueblo Nuevo: Ca. 2.5 km S. of El Salto along raod to Santa Barbara.	Marshy stream bank in flat bottomed valley in open Pinus cooperi forest.	Senecio billieturneri, Scirpus microcarpus, Sparganium, Juncus, Carex	scarce on stream bank.	23°45'14"N	105°22'50"W		2550m					Carex durangensis	number listed for accession # is num on barcode.	no	1								TRUE	Carex_durangensis|MXE|spm00000272	Mexico: Durango	MN760903	MN761574	MN763060	Global biogeography of Carex (Martin-Bravo et al.)	yes
spm00000273		Carex hultenii	Aspl.		urn:kew.org:wcs:taxon:227440	accepted					MOR	yes	herbarium leaf tissue	5/1/2013	Anton Reznicek (MICH)	REZNICEK	Carex hultenii	NA	MICH.1132627	MICH	S. Gonzalez & A.A. Reznicek w/ M. Gonzalez & M. Pinedo	10732	MXE	Mexico	Hidalgo			Mpio. Chapulhuacan: 1 km N of Chapulhuacan, along road to Tamasunchale (Mex Hwy 85).	Moist montane forest		Infrequent, but widespread in one small area	21°09'58"N	98°54'02" W		830m					Carex hultenii	number listed for accession # is num on barcode.	no	1								TRUE	Carex_hultenii|MXE|spm00000273	Mexico: Hidalgo	MN759933	MN761529		Global biogeography of Carex (Martin-Bravo et al.)	yes
spm00000274		Carex longicaulis	Boeckeler		urn:kew.org:wcs:taxon:228255	accepted					MOR	yes	herbarium leaf tissue	5/1/2013	Anton Reznicek (MICH)	REZNICEK	Carex longicaulis	NA	MICH.1132703	MICH	P.F. Zika	15375	MXG	Mexico	Veracruz			on road to Microodas Las Lajas, 14 road km S of Las Vigas de Ramirez	dry slope under pines.	Alnus, Galium, Castilleja hirsuta, Eryngium, Lopezia, Dryopteris.	loosely cespitose									Carex longicaulis	number listed for accession # is num on barcode.	no	1								TRUE	Carex_longicaulis|MXG|spm00000274	Mexico: Veracruz	MN760634	MN761485	MN763519	Global biogeography of Carex (Martin-Bravo et al.)	yes
spm00000275	Filifoliae	Carex longissima	M.E.Jones	aff.	urn:kew.org:wcs:taxon:228297	accepted					MOR	yes	herbarium leaf tissue	5/1/2013	Anton Reznicek (MICH)	REZNICEK	Carex sp. aff. longissima	NA	MICH-V-1449808	MICH	A.A. Reznicek & S. Gonzalez w/ M. Pinedo	11121	MXE	Mexico	Durango			Mpio. Pueblo Nuevo: Ca. 1.7-2 km N of El palmito, on Hwy 40 (Durango-Mazatlan Hwy).	rock ledges and cliffs in Pinus-Quercus-Arbutus forest		very abundant in large clumps on seepy, mossy ledges and cliff faces, plants arching or even pendulous when on cliff faces.	23°34'01"N	105°49'47"W		2000-2070m					Carex longissima	number listed for accession # is num on barcode/off scanned sheet- I can't exactly make out 2nd number- I think it's a 2???	no	1								TRUE	Carex_longissima|MXE|spm00000275	Mexico: Durango	MN759849	MN761860	MN762988	Global biogeography of Carex (Martin-Bravo et al.)	yes
spm00000276		Carex scoparia	Willd.	cf.	urn:kew.org:wcs:taxon:230759	accepted		Anton Reznicek|S.Martin Bravo & P. Jimenez-Mejias			MOR	yes	unmounted SNM sheet	5/1/2013	Anton Reznicek (MICH)	REZNICEK	Carex scoparia|Carex scoparia aff New Mexico|	NA	R.C. Sivinski w/ T. Lowrey and Phil Tonne 8121		R.C. Sivinski w/ T. Lowrey and Phil Tonne	8121	NWM	USA	New Mexico	Hidalgo	County		wet alkaline meadow.		growing in individual clumps	31.52817	-108.87275		6000ft					Carex scoparia aff New Mexico	umounted SNM sheet (sent undetermined)	no	1								TRUE	Carex_scoparia|NWM|spm00000276	USA: New Mexico, Hidalgo County	MN760264	MN761709	MN762964	Global biogeography of Carex (Martin-Bravo et al.)	yes
spm00000277		Carex madrensis	L.H.Bailey		urn:kew.org:wcs:taxon:228447	accepted		Anton Reznicek			MOR	yes	herbarium leaf tissue	6/13/2013	Anton Reznicek (MICH)	REZNICEK	Carex madrensis	NA	MICH.1132747	MICH	M. Fuentes O.	491	MXS	Mexico	Jalisco			Mpio Tecalitlan. 50.7 km al SSE de Cd. Guzman. Carr. A Llanitos y brecha a Plan de Lego; y 10.4 km al E por brecha de P. de Lego a Soyatal; bosque de pino y encino, degradado, dominancia de Pinus douglasiana: suelo prof.,												Carex madrensis	number listed for accession # is num on barcode; [AAR 2015-07-07: this is a simple-spiked Indicae]	no	1								TRUE	Carex_madrensis|MXS|spm00000277	Mexico: Jalisco		MN761530		Global biogeography of Carex (Martin-Bravo et al.)	yes
spm00000278		Carex longii	Mack.		urn:kew.org:wcs:taxon:228267	accepted		Anton Reznicek			MOR	yes	herbarium leaf tissue	6/13/2013	Anton Reznicek (MICH)	REZNICEK	Carex longii	NA	MICH 1132718	MICH	S. Gonzalez & A.A. Reznicek w/ M. Gonzalez & M. Pinedo	10802	MSX	Mexico	Michoacan			Mpio. Morelia: On the old Morelia-Patzcuaro road, beside house no. 8000.												Carex longii	number listed for accession # is num on barcode.	no	1								TRUE	Carex_longii|MSX|spm00000278	Mexico: Michoacan	MN760261	MN761906	MN762965	Global biogeography of Carex (Martin-Bravo et al.)	yes
spm00000279		Carex longii	Mack.		urn:kew.org:wcs:taxon:228267	accepted		Anton Reznicek			MOR	yes	herbarium leaf tissue	6/13/2013	Anton Reznicek (MICH)	REZNICEK	Carex longii	NA	MICH 1132730	MICH	W.R. Anderson, M.W. Chase, and A.A. Reznicek	13246	MXT	Mexico	Chiapas			2 km N of Jitotol on road to Pichucalco												Carex longii	number listed for accession # is num on barcode.	no	1								TRUE	Carex_longii|MXT|spm00000279	Mexico: Chiapas	MN760263	MN761916	MN763522	Global biogeography of Carex (Martin-Bravo et al.)	yes
spm00000280		Carex marianensis	Stacey		urn:kew.org:wcs:taxon:228508	accepted		Anton Reznicek			MOR	yes	herbarium leaf tissue	6/13/2013	Anton Reznicek (MICH)	REZNICEK	Carex marianensis	NA	S. & G. Jones 5476	MICH	S. & G. Jones	5476	MXE	Mexico	Hidalgo			1.6 miles NE on Mex 136 from its jct. with the Hidalgo-Mexic State line.												Carex marianensis	no barcode on scanned herbarium sheet, but I believe this is from MICH herbarium along with rest of materials sent	no	1								TRUE	Carex_marianensis|MXE|spm00000280	Mexico: Hidalgo	MN760833	MN761915	MN763002	Global biogeography of Carex (Martin-Bravo et al.)	yes
spm00000281		Carex mcvaughii	Reznicek		urn:kew.org:wcs:taxon:228548	accepted		Anton Reznicek			MOR	yes	herbarium leaf tissue	6/13/2013	Anton Reznicek (MICH)	REZNICEK	Carex mcvaughii	Carex_MOR_246	MICH.1132759	MICH	M. Fuentes O.	124	MXS	Mexico	Jalisco			Mpio Tecalitlan. 48 km al S de Cd. Guzman por carr. A Pihuamo. Luego 67 km al S por brecha de Llanitos a Mexiquillo, luego 7 km al S de Mexiquillo por brecha secundaria												Carex mcvaughii	number listed for accession # is num on barcode.	no	1								FALSE		Mexico: Jalisco
spm00000282		Carex occidentalis	L.H.Bailey	cf.	urn:kew.org:wcs:taxon:229180	accepted		Anton Reznicek			MOR	yes	herbarium leaf tissue	6/13/2013	Anton Reznicek (MICH)	REZNICEK	Carex sp. cf. occidentalis	NA	MICH.1132828	MICH	S. Gonzalez & A.A. Reznicek w/ M. Gonzalez & M. Pinedo	10798	MXC	Mexico	Puebla			Mpio. Esperanza: Km 230.4 on toll road from Mexico to Orizaba, very close to the Puebla-Veracruz border.												Carex occidentalis	number listed for accession # is num on barcode.	no	1								TRUE	Carex_occidentalis|MXC|spm00000282	Mexico: Puebla	MN760243	MN761904	MN763085	Global biogeography of Carex (Martin-Bravo et al.)	yes
spm00000283		Carex orizabae	Liebm.		urn:kew.org:wcs:taxon:229322	accepted		Anton Reznicek			MOR	yes	herbarium leaf tissue	6/13/2013	Anton Reznicek (MICH)	REZNICEK	Carex orizabae	NA	MICH.1132842	MICH	P.F. Zika	15381	MXC	Mexico	Puebla			14 road km above San Miguel Zuapan on road to climbers camp, NW slopes of Volcan Pico de Orizaba,												Carex orizabae	number listed for accession # is num on barcode.	no	1								TRUE	Carex_orizabae|MXC|spm00000283	Mexico: Puebla	MN760335	MN761714	MN762998	Global biogeography of Carex (Martin-Bravo et al.)	yes
spm00000284		Carex pinophila	Reznicek & S.González	aff.	urn:kew.org:wcs:taxon:229796	accepted		Anton Reznicek			MOR	yes	herbarium leaf tissue	6/13/2013	Anton Reznicek (MICH)	REZNICEK	Carex aff. pinophila	NA	MICH.1216168	MICH	A.A. Reznicek w/ S. Zamudio, G. Ocampo	11095	MXE	Mexico	Queretaro			Mpio. Landa de Matamoros: Llano Chiquito Valley, north extreme, west of El Puerto del Conejo.												Carex pinophila	number listed for accession # is num on barcode.	no	1								TRUE	Carex_pinophila|MXE|spm00000284	Mexico: Queretaro	MN760566	MN761614	MN763061	Global biogeography of Carex (Martin-Bravo et al.)	yes
spm00000285		Carex planostachys	Kunze		urn:kew.org:wcs:taxon:229817	accepted		Anton Reznicek			MOR	yes	herbarium leaf tissue	6/13/2013	Anton Reznicek (MICH)	REZNICEK	Carex planostachys	NA	MICH.1132789	MICH	S. Gonzalez & A.A. Reznicek w/ M. Pinedo	10288	MXE	Mexico	Queretaro			Mpio. Landa de Matamoros: Between El Lobo and Landa, near entrance to Ranch La Sierrita, ca. 18 km (air) NE of Landa.												Carex planostachys	number listed for accession # is num on barcode.	no	1								TRUE	Carex_planostachys|MXE|spm00000285	Mexico: Queretaro	MN760529		MN763548	Global biogeography of Carex (Martin-Bravo et al.)	yes
